Date,Lie,Url,Explanation
2017-05-04,"Number two, they’re actually not a currency [manipulator]. You know, since I’ve been talking about currency manipulation with respect to them and other countries, they stopped.",https://www.nytimes.com/2017/04/07/world/asia/fact-check-trump-china-trade.html,China stopped years ago.
2017-05-04,We’re the highest-taxed nation in the world.,http://www.politifact.com/truth-o-meter/statements/2016/may/08/donald-trump/donald-trump-us-not-highest-taxed-nation-in-world/,We're not.
2017-05-04,Nobody cares about my tax return except for the reporters.,http://time.com/money/4732925/trump-tax-returns-released-poll/,Polls show most Americans do care.
2017-05-08,You know we’ve gotten billions of dollars more in NATO than we’re getting. All because of me.,https://www.nytimes.com/2017/03/01/us/politics/fact-check-trump-military.html,The deal was struck in 2014.
2017-05-08,"But when I did his show, which by the way was very highly rated. It was high — highest rating. The highest rating he’s ever had.",http://money.cnn.com/2017/05/11/media/stephen-colbert-trump-no-talent-comment/,Colbert's Late Show debut had nearly two million more viewers.
2017-05-08,"Director Clapper reiterated what everybody, including the fake media already knows — there is ‘no evidence’ of collusion w/ Russia and Trump.",https://www.nytimes.com/2017/05/10/us/politics/fact-check-fbi-james-comey-sarah-huckabee-sanders.html,Clapper only said he wasn't aware of an investigation.
2017-05-12,"Again, the story that there was collusion between the Russians & Trump campaign was fabricated by Dems as an excuse for losing the election.",https://www.nytimes.com/interactive/2017/05/10/us/politics/fbi-congress-trump-russia-investigations.html,The F.B.I. was investigating before the election.
2017-05-12,"When James Clapper himself, and virtually everyone else with knowledge of the witch hunt, says there is no collusion, when does it end?",https://www.nytimes.com/2017/05/10/us/politics/fact-check-fbi-james-comey-sarah-huckabee-sanders.html,Clapper said he wouldn't have been told of an investigation into collusion.
2017-05-13,I'm cutting the price of airplanes with Lockheed.,https://www.washingtonpost.com/news/fact-checker/wp/2017/01/31/trumps-claim-taking-credit-for-cutting-600-million-from-the-f-35-program/,The cost cuts were planned before he became president.
2017-05-26,Just arrived in Italy for the G7. Trip has been very successful. We made and saved the USA many billions of dollars and millions of jobs.,https://www.washingtonpost.com/news/fact-checker/wp/2017/05/26/president-trumps-claim-that-hes-already-saved-millions-of-jobs-on-his-foreign-trip/?utm_term=.820dd5955428,He's referencing an arms deal that's not enacted and other apparent deals that weren't announced on the trip.
2017-06-01,"China will be allowed to build hundreds of additional coal plants. So, we can’t build the plants, but they can, according to this agreement. India will be allowed to double its coal production by 2020.",https://www.washingtonpost.com/news/the-fix/wp/2017/06/01/transcript-president-trumps-remarks-on-leaving-the-paris-climate-deal-annotated/?utm_term=.7f974232c4ba,The agreement doesn’t allow or disallow building coal plants.
2017-06-01,"I’ve just returned from a trip overseas where we concluded nearly $350 billion of military and economic development for the United States, creating hundreds of thousands of jobs.",https://www.washingtonpost.com/news/fact-checker/wp/2017/06/08/the-trump-administrations-tally-of-350-billion-plus-in-deals-with-saudi-arabia/?utm_term=.142db3117855,Trump’s figures are inflated and premature.
2017-06-04,At least 7 dead and 48 wounded in terror attack and Mayor of London says there is ‘no reason to be alarmed!’,http://www.snopes.com/2017/06/04/london-mayor-sadiq-khan-no-reason-to-be-alarmed-trump/,The mayor was specifically talking about the enlarged police presence on the streets.
2017-06-05,"The Justice Dept. should have stayed with the original Travel Ban, not the watered down, politically correct version they submitted to S.C.",http://www.factcheck.org/2017/06/trumps-tweets-twist-facts/,"Trump signed this version of the travel ban, not the Justice Department."
2017-06-20,"Well, the Special Elections are over and those that want to MAKE AMERICA GREAT AGAIN are 5 and O!",https://www.washingtonpost.com/news/the-fix/wp/2017/06/21/republicans-claim-a-big-victory-and-trump-promptly-exaggerates-it/?utm_term=.ce22a6dade36,"Republicans have won four special elections this year, while a Democrat won one."
2017-06-21,They all say it's 'nonbinding.' Like hell it's nonbinding.,https://www.nytimes.com/2017/06/21/us/politics/trump-iowa-rally-venting-session.html,The Paris climate agreement is nonbinding — and Trump said so in his speech announcing the withdrawal.
2017-06-21,"Right now, we are one of the highest-taxed nations in the world.",http://www.politifact.com/truth-o-meter/article/2017/jun/22/fact-checking-nine-things-trump-overstated-got-wro/,We're not.
2017-06-21,"You have a gang called MS-13. ... We are moving them out of the country by the thousands, by the thousands.",http://www.factcheck.org/2017/06/factchecking-trumps-iowa-rally,The real number of gang members deported is smaller.
2017-06-21,Your insurance companies have all fled the state of Iowa.,http://www.factcheck.org/2017/06/factchecking-trumps-iowa-rally/,They haven't.
2017-06-21,"If [farmers] have a puddle in the middle of their field ... it's considered a lake and you can't touch it. ... We got rid of that one, too, O.K.?",https://www.nytimes.com/2017/06/22/us/politics/factcheck-donald-trump-iowa-rally.html,The Obama environmental rule to limit pollution in the country’s waters explicitly excludes puddles.
2017-06-21,"Gary Cohn just paid $200 million in tax in order to take this job, by the way.",https://www.nytimes.com/2017/06/22/us/politics/factcheck-donald-trump-iowa-rally.html,Cohn sold Goldman Sachs stock worth $220 million.
2017-06-21,We’re 5 and 0.,https://www.washingtonpost.com/graphics/politics/trump-claims-database/?utm_term=.60ce71155f60,"Republicans have won four special elections this year, while a Democrat won one."
2017-06-21,"Last week a brand-new coal mine just opened in the state of Pennsylvania, first time in decades, decades.",https://www.washingtonpost.com/graphics/politics/trump-claims-database/?utm_term=.60ce71155f60,Another coal mine opened in 2014.
2017-06-22,Former Homeland Security Advisor Jeh Johnson is latest top intelligence official to state there was no grand scheme between Trump & Russia.,http://talkingpointsmemo.com/livewire/trump-claims-johnson-testimony-clears-him,"Johnson, who had a different title, didn't say that."
2017-06-23,We are 5 and 0 ... in these special elections.,http://www.chicagotribune.com/news/nationworld/politics/factcheck/ct-fact-check-trump-missions-20170624-story.html,"Republicans have won four special elections this year, while a Democrat won one."
2017-06-27,Ratings way down!,http://www.politifact.com/truth-o-meter/statements/2017/jul/03/donald-trump/trumps-pants-fire-claim-cnn-ratings-are-way-down/,CNN's ratings were at a five-year high at the time.
2017-06-28,Democrats purposely misstated Medicaid under new Senate bill — actually goes up.,https://www.washingtonpost.com/news/fact-checker/wp/2017/06/30/president-trumps-claim-medicaid-spending-in-senate-health-bill-actually-goes-up/?utm_term=.a319dee54870,Senate bill would have cut the program deeply.
2017-06-29,"General Kelly and his whole group — they’ve gotten rid of 6,000 so far.",https://www.washingtonpost.com/graphics/politics/trump-claims-database/?utm_term=.aa961e129167,The real number of MS-13 gang members who have been deported is smaller.
2017-07-06,"As a result of this insistence, billions of dollars more have begun to pour into NATO.",http://www.nbcnews.com/politics/donald-trump/fact-check-long-trump-took-credit-nato-spending-was-n780241,NATO countries agreed to meet defense spending requirements in 2014.
2017-07-17,"We’ve signed more bills — and I’m talking about through the legislature — than any president, ever.",https://www.nytimes.com/2017/07/17/us/politics/trump-laws-bills.html,"Clinton, Carter, Truman, and F.D.R. had signed more at the same point."
2017-07-19,"Um, the Russian investigation — it’s not an investigation, it’s not on me — you know, they’re looking at a lot of things.",http://time.com/4823514/donald-trump-investigation-jay-sekulow/,It is.
2017-07-19,"I heard that Harry Truman was first, and then we beat him. These are approved by Congress. These are not just executive orders.",https://www.nytimes.com/2017/07/17/us/politics/trump-laws-bills.html,"Presidents Clinton, Carter, Truman, and F.D.R. each had signed more legislation than Trump at the same point in their terms."
2017-07-19,"But the F.B.I. person really reports directly to the president of the United States, which is interesting.",https://www.usatoday.com/story/news/politics/onpolitics/2017/07/20/fbi-director-reports-justice-department-not-president/495094001/,He reports directly to the attorney general.
